{
  "schema": "agent-frontdoor.v0.1",
  "task_id": "20260101_example_001",
  "timestamp": "2026-01-01T10:00:00Z",
  "input_summary": "Inspect the test output directory and classify files for potential cleanup",
  "task_class": "READ_ONLY_AUDIT",
  "task_subclass": null,
  "risk_tags": ["cleanup_adjacent", "manifest_required"],
  "predicted_worker": ["local-classifier-worker", "architect-review-worker"],
  "predicted_confidence": "medium",
  "allowed_actions": ["inspect_files", "classify_candidates", "produce_manifest"],
  "forbidden_actions": ["delete", "archive", "mark_obsolete_final"],
  "required_evidence": ["file_list", "candidate_labels"],
  "required_manifest": "dedupe_manifest",
  "human_gate": "required",
  "actual_worker": null,
  "substitution_reason": null,
  "routing_deviation": false,
  "boundary_drift": false,
  "boundary_drift_reason": null,
  "unknowns": [],
  "assumptions": ["cleanup_keywords_present"],
  "next_safe_step": "Produce dedupe_manifest of candidates only; do not delete until human approves",
  "ledger_note": "Inspection task. Manifest required before any deletion decision."
}
