{
  "schema": "agent-frontdoor.v0.1",
  "task_id": "20260101_example_008",
  "timestamp": "2026-01-01T10:07:00Z",
  "input_summary": "Something seems off with the output but I'm not sure what to do",
  "task_class": "UNKNOWN",
  "task_subclass": null,
  "risk_tags": ["stale_authority_risk", "human_approval_required"],
  "predicted_worker": ["architect-review-worker"],
  "predicted_confidence": "low",
  "allowed_actions": ["ask_clarifying_question", "produce_diagnosis_candidates"],
  "forbidden_actions": ["take_corrective_action", "modify_any_files", "escalate_autonomously"],
  "required_evidence": ["clarified_task_description"],
  "required_manifest": "none",
  "human_gate": "required",
  "actual_worker": null,
  "substitution_reason": null,
  "routing_deviation": false,
  "boundary_drift": false,
  "boundary_drift_reason": null,
  "unknowns": ["what 'something seems off' refers to", "which system or file is affected"],
  "assumptions": [],
  "next_safe_step": "Ask human for clarification before taking any action",
  "ledger_note": "Classification unclear. Human clarification required before dispatch."
}
