{
  "schema": "agent-frontdoor.v0.1",
  "task_id": "20260101_example_007",
  "timestamp": "2026-01-01T10:06:00Z",
  "input_summary": "Check the current status of the pending migration tasks",
  "task_class": "STATUS_CLASSIFICATION",
  "task_subclass": null,
  "risk_tags": [],
  "predicted_worker": ["local-classifier-worker"],
  "predicted_confidence": "high",
  "allowed_actions": ["read_task_list", "classify_statuses", "produce_status_report"],
  "forbidden_actions": ["modify_task_status", "close_tasks", "delete_tasks"],
  "required_evidence": [],
  "required_manifest": "none",
  "human_gate": "none",
  "actual_worker": null,
  "substitution_reason": null,
  "routing_deviation": false,
  "boundary_drift": false,
  "boundary_drift_reason": null,
  "unknowns": [],
  "assumptions": ["task list is up-to-date"],
  "next_safe_step": "Read task list and produce status report",
  "ledger_note": "Read-only status check. No gates required."
}
