{
  "schema": "agent-frontdoor.v0.1",
  "task_id": "20260101_example_004",
  "timestamp": "2026-01-01T10:03:00Z",
  "input_summary": "Review the proposed event sourcing architecture for the new intake pipeline",
  "task_class": "DESIGN_REVIEW",
  "task_subclass": null,
  "risk_tags": ["authority_promotion_risk"],
  "predicted_worker": ["architect-review-worker"],
  "predicted_confidence": "high",
  "allowed_actions": ["read_design_docs", "produce_review_report", "flag_risks"],
  "forbidden_actions": ["modify_design_docs", "implement", "approve_on_behalf_of_human"],
  "required_evidence": ["design_document"],
  "required_manifest": "none",
  "human_gate": "required",
  "actual_worker": null,
  "substitution_reason": null,
  "routing_deviation": false,
  "boundary_drift": false,
  "boundary_drift_reason": null,
  "unknowns": ["whether the proposed schema is backward-compatible with existing ledger entries"],
  "assumptions": ["design document is the final draft, not a work-in-progress"],
  "next_safe_step": "Read design doc and produce review report. Escalate open questions to human.",
  "ledger_note": "Design review. Human approves or rejects after review report is produced."
}
