{
  "schema": "agent-frontdoor.v0.1",
  "task_id": "20260101_example_005",
  "timestamp": "2026-01-01T10:04:00Z",
  "input_summary": "Audit the task backlog and identify candidates for archiving or deletion",
  "task_class": "CLEANUP_PLANNING",
  "task_subclass": null,
  "risk_tags": ["cleanup_adjacent", "deletion_sensitive", "retention_decision"],
  "predicted_worker": ["local-classifier-worker", "architect-review-worker"],
  "predicted_confidence": "medium",
  "allowed_actions": ["read_backlog", "classify_items", "produce_candidate_list"],
  "forbidden_actions": ["delete", "archive", "mark_resolved", "close_tickets"],
  "required_evidence": ["backlog_snapshot"],
  "required_manifest": "dedupe_manifest",
  "human_gate": "required",
  "actual_worker": null,
  "substitution_reason": null,
  "routing_deviation": false,
  "boundary_drift": false,
  "boundary_drift_reason": null,
  "unknowns": [],
  "assumptions": ["backlog items have clear status labels"],
  "next_safe_step": "Produce candidate list grouped by archival/deletion/keep. Await human retention decision.",
  "ledger_note": "Cleanup planning only. No mutations until human approves the manifest."
}
