{
  "schema": "agent-frontdoor.v0.1",
  "task_id": "20260101_example_003",
  "timestamp": "2026-01-01T10:02:00Z",
  "input_summary": "Fix the off-by-one error in the pagination utility and add a regression test",
  "task_class": "IMPLEMENTATION",
  "task_subclass": null,
  "risk_tags": ["scope_drift_risk"],
  "predicted_worker": ["implementation-worker", "architect-review-worker"],
  "predicted_confidence": "high",
  "allowed_actions": ["edit_target_files", "add_tests", "run_targeted_tests"],
  "forbidden_actions": ["modify_schema", "change_api_contracts", "deploy", "edit_config_files"],
  "required_evidence": ["failing_test_before", "passing_test_after"],
  "required_manifest": "diff_manifest",
  "human_gate": "none",
  "actual_worker": null,
  "substitution_reason": null,
  "routing_deviation": false,
  "boundary_drift": false,
  "boundary_drift_reason": null,
  "unknowns": [],
  "assumptions": ["target files are within the approved implementation scope"],
  "next_safe_step": "Edit only the pagination utility; run existing tests before and after",
  "ledger_note": "Scoped implementation. diff_manifest required for review."
}
