{
  "schema": "agent-frontdoor.v0.1",
  "task_id": "20260101_example_006",
  "timestamp": "2026-01-01T10:05:00Z",
  "input_summary": "Update the CI pipeline schedule configuration to run nightly instead of hourly",
  "task_class": "SSOT_MUTATION",
  "task_subclass": null,
  "risk_tags": ["scheduler_risk", "human_approval_required", "ssot_mutation_risk"],
  "predicted_worker": ["architect-review-worker"],
  "predicted_confidence": "high",
  "allowed_actions": ["read_current_config", "produce_proposed_diff"],
  "forbidden_actions": ["apply_schedule_change", "restart_scheduler", "edit_config_directly"],
  "required_evidence": ["current_config_snapshot", "proposed_diff", "human_approval"],
  "required_manifest": "approval_manifest",
  "human_gate": "blocking",
  "actual_worker": null,
  "substitution_reason": null,
  "routing_deviation": false,
  "boundary_drift": false,
  "boundary_drift_reason": null,
  "unknowns": ["whether downstream jobs depend on the current hourly cadence"],
  "assumptions": [],
  "next_safe_step": "Read current config and produce proposed diff only. Human applies after review.",
  "ledger_note": "Schedule config change. Blocking gate: human must apply change, not agent."
}
