{
  "schema": "agent-frontdoor.v0.1",
  "task_id": "20260101_example_002",
  "timestamp": "2026-01-01T10:01:00Z",
  "input_summary": "Remove stale build artifacts from the temporary output folder",
  "task_class": "DELETE_ARCHIVE_REQUEST",
  "task_subclass": null,
  "risk_tags": ["deletion_sensitive", "manifest_required", "human_approval_required"],
  "predicted_worker": ["none-until-approval"],
  "predicted_confidence": "high",
  "allowed_actions": ["produce_deletion_manifest", "flag_candidates"],
  "forbidden_actions": ["delete", "rm", "move_to_archive", "execute_deletion"],
  "required_evidence": ["deletion_manifest", "human_approval"],
  "required_manifest": "approval_manifest",
  "human_gate": "blocking",
  "actual_worker": null,
  "substitution_reason": null,
  "routing_deviation": false,
  "boundary_drift": false,
  "boundary_drift_reason": null,
  "unknowns": ["which artifacts are safe to delete without affecting reproducibility"],
  "assumptions": [],
  "next_safe_step": "Produce manifest listing deletion candidates. Do not delete until human provides explicit approval.",
  "ledger_note": "Deletion request. Blocked until human approval received."
}
